{
  "$schema": "https://json-schema.org/draft/2020-12/schema",
  "$id": "https://specx.dev/contracts/tool_definition.schema.json",
  "title": "ToolDefinition",
  "description": "One atomic WebMCP tool generated by F3. Owned by Dev A. Consumed by Dev B (S1 action space, S2 graph nodes) and Dev C (agent tool list, F2/S4 metadata revisions).",
  "type": "object",
  "additionalProperties": false,
  "required": [
    "tool_id",
    "app",
    "name",
    "description",
    "input_schema",
    "handler",
    "risk_level",
    "atomic",
    "provenance",
    "version",
    "metadata_revision"
  ],
  "properties": {
    "tool_id": {
      "type": "string",
      "pattern": "^[a-z0-9_]+\\.[a-z0-9_]+$",
      "description": "<app>.<name>, globally unique, never changes across revisions."
    },
    "app": {
      "type": "string",
      "pattern": "^[a-z0-9_]+$",
      "description": "Seed app id, e.g. shop, admin, blog."
    },
    "name": {
      "type": "string",
      "pattern": "^[a-z][a-z0-9_]{2,63}$",
      "description": "Agent-facing tool name. F2/S4 may revise this."
    },
    "description": {
      "type": "string",
      "minLength": 10,
      "maxLength": 1000,
      "description": "Agent-facing description. F2/S4 may revise this."
    },
    "input_schema": {
      "type": "object",
      "description": "JSON Schema (draft 2020-12) object with type=object, properties, required, additionalProperties=false. F2/S4 may revise descriptions/enums only, never remove required params."
    },
    "output_schema": {
      "type": "object",
      "description": "Optional JSON Schema of the handler return value. Field names here drive data-dependency edges in the workflow graph."
    },
    "handler": {
      "type": "object",
      "additionalProperties": false,
      "required": [
        "kind",
        "code"
      ],
      "properties": {
        "kind": {
          "type": "string",
          "enum": [
            "api",
            "ui"
          ],
          "description": "api = handler calls fetch() against the app's own API; ui = handler fills the page's own controls and clicks its own button, so the app's code runs and the page updates (WebMCP-native)."
        },
        "code": {
          "type": "string",
          "description": "JavaScript async function body, evaluated in page context by the sandbox: `async (input) => { ... return output }`. Must only touch approved endpoints/selectors."
        },
        "http": {
          "type": "object",
          "additionalProperties": false,
          "required": [
            "method",
            "path_template"
          ],
          "properties": {
            "method": {
              "type": "string",
              "enum": [
                "GET",
                "POST",
                "PUT",
                "PATCH",
                "DELETE"
              ]
            },
            "path_template": {
              "type": "string",
              "description": "e.g. /api/cart/{product_id}"
            }
          }
        },
        "selectors": {
          "type": "array",
          "items": {
            "type": "string"
          },
          "description": "CSS selectors a ui handler relies on (for provenance + S4 fix_selector patches)."
        },
        "page": {
          "type": "string",
          "description": "WebMCP page scope: the page pattern this tool is registered on (e.g. /products/:id), or \"*\" for every page. ui handlers act on the page they run in; context such as the product shown comes from the page, not from arguments."
        },
        "page_example": {
          "type": "string",
          "description": "A concrete page (e.g. /products/1) the crawler saw this control on; the sandbox uses it when no page is given."
        }
      }
    },
    "risk_level": {
      "type": "string",
      "enum": [
        "read",
        "write",
        "delete",
        "payment"
      ],
      "description": "Ordered severity. Drives graph node colouring, policy checks and S2 labels."
    },
    "atomic": {
      "type": "boolean",
      "const": true
    },
    "provenance": {
      "type": "array",
      "minItems": 1,
      "items": {
        "type": "object",
        "additionalProperties": false,
        "required": [
          "surface",
          "ref"
        ],
        "properties": {
          "surface": {
            "type": "string",
            "enum": [
              "code",
              "dom",
              "aria",
              "network",
              "test"
            ]
          },
          "ref": {
            "type": "string",
            "description": "file:line, CSS selector, aria role/name, HTTP method+path, or test file."
          },
          "snippet": {
            "type": "string",
            "maxLength": 2000
          }
        }
      }
    },
    "version": {
      "type": "integer",
      "minimum": 1,
      "description": "Bumped when the handler/action changes (F3 regeneration)."
    },
    "metadata_revision": {
      "type": "integer",
      "minimum": 0,
      "description": "Bumped by F2/S4 each time name/description/input_schema text changes. 0 = as generated."
    },
    "status": {
      "type": "string",
      "enum": [
        "generated",
        "verified",
        "quarantined"
      ],
      "description": "Set by F1 verify stage. Absent = generated."
    }
  }
}
